alfisols_Area,andisols_Area,bjd_Nm,entisols_Area,etc_Area,histosols_Area,inceptisols_Area,mollisols_Area,stdg_Cd,ultisols_Area
33,0,대구광역시 동구 송정동,77,0,0,169,0,2714014300,20
9,0,대전광역시 유성구 용계동,5,5,0,252,0,3020010400,0
0,0,대전광역시 유성구 학하동,38,17,0,166,0,3020010500,0
3,0,대전광역시 중구 구완동,18,0,0,353,0,3014012100,0
4,0,대전광역시 유성구 송정동,17,8,0,370,0,3020010900,0
286,0,경상북도 예천군 용궁면,101,309,0,2452,0,4790038000,52
98,0,경상북도 예천군 용궁면 읍부리,0,5,0,36,0,4790038021,3
19,0,경상북도 예천군 용궁면 가야리,1,11,0,212,0,4790038023,1
19,0,경상북도 예천군 용궁면 무이리,11,39,0,228,0,4790038024,0
35,0,경상북도 예천군 용궁면 대은리,61,104,0,391,0,4790038026,36
27,0,경기도 김포시 하성면 전류리,0,160,0,221,0,4157036031,5
15,0,경기도 김포시 하성면 마근포리,0,168,0,137,0,4157036032,0
1,0,경기도 김포시 월곶면 고막리,0,4,0,353,0,4157035022,0
8,0,경기도 안성시 보개면 기좌리,6,4,0,264,0,4155031022,0
4,0,경기도 이천시 마장면 이치리,3,4,0,347,0,4150034028,5
21,0,경기도 이천시 마장면 각평리,0,12,0,279,0,4150034029,0
20,0,경기도 이천시 마장면 이평리,17,16,0,360,0,4150034031,3
14,0,경기도 이천시 마장면 해월리,114,4,0,434,0,4150034032,0
45,0,경기도 이천시 대월면,46,66,0,2988,0,4150035000,0
2,0,경기도 이천시 대월면 초지리,3,9,0,322,0,4150035025,0
0,0,경기도 안성시 인지동,11,0,0,0,0,4155011300,0
0,0,경기도 안성시 금산동,0,0,0,32,0,4155011400,0
0,0,경기도 안성시 대천동,0,0,0,5,0,4155011600,0
121,0,경상북도 예천군 예천읍,244,274,0,4005,0,4790025000,128
0,0,경상북도 예천군 예천읍 노하리,0,0,0,6,0,4790025021,0
0,0,경상북도 예천군 예천읍 노상리,0,0,0,13,0,4790025022,0
1,0,경상북도 예천군 예천읍 동본리,24,20,0,185,0,4790025024,0
8,0,경상북도 예천군 예천읍 서본리,6,14,0,93,0,4790025026,0
11,0,경상북도 예천군 예천읍 대심리,10,25,0,278,0,4790025027,0
122,0,전라남도 고흥군 포두면 남성리,36,89,0,871,0,4677035021,0
71,0,전라남도 고흥군 포두면 차동리,7,10,0,552,0,4677035023,96
83,0,전라남도 고흥군 포두면 세동리,26,13,0,356,0,4677035024,19
51,0,전라남도 고흥군 포두면 상대리,9,11,0,492,0,4677035026,4
95,0,전라남도 고흥군 포두면 봉림리,25,29,0,1297,0,4677035027,0
81,0,전라남도 고흥군 도화면 신호리,31,9,0,581,0,4677034028,36
264,0,전라남도 보성군 복내면,282,446,0,5666,0,4678035000,43
17,0,전라남도 보성군 복내면 복내리,0,48,0,100,0,4678035021,0
10,0,전라남도 보성군 복내면 용동리,3,4,0,263,0,4678035023,0
35,0,전라남도 보성군 복내면 진봉리,86,9,0,1094,0,4678035024,4
14,0,전라남도 보성군 복내면 일봉리,76,11,0,1137,0,4678035026,7
3,0,전라남도 보성군 복내면 시천리,12,102,0,356,0,4678035027,0
57,0,전라남도 고흥군 영남면 양사리,23,13,0,749,0,4677044021,16
76,0,전라남도 고흥군 영남면 금사리,77,44,0,1337,0,4677044022,9
47,0,전라남도 고흥군 영남면 남열리,18,4,0,347,0,4677044023,71
259,0,전라남도 고흥군 동일면,62,34,0,1678,0,4677045000,73
104,0,전라남도 고흥군 동일면 봉영리,11,8,0,558,0,4677045021,2
9,0,전라남도 보성군 율어면 고죽리,21,1,0,328,0,4678034026,0
28,0,경상북도 칠곡군 기산면 각산리,17,6,0,662,0,4785037033,0
22,0,경상북도 칠곡군 기산면 노석리,6,38,0,435,0,4785037034,10
89,0,경상북도 포항시북구 신광면 우각리,6,15,0,356,0,4711331023,39
58,0,경상북도 포항시북구 신광면 상읍리,0,8,0,390,0,4711331025,8
38,0,경상북도 포항시북구 신광면 토성리,15,10,0,200,0,4711331026,0
60,0,경상북도 포항시북구 신광면 안덕리,0,8,0,483,0,4711331028,13
53,0,경상북도 포항시북구 신광면 만석리,45,18,0,249,0,4711331029,0
36,0,경상북도 포항시북구 신광면 기일리,2,4,0,647,0,4711331031,248
43,0,경상북도 포항시북구 죽장면 입암리,17,24,0,530,0,4711335024,42
7,0,경상북도 포항시북구 죽장면 일광리,28,38,0,1050,0,4711335025,26
22,0,경상북도 포항시북구 죽장면 정자리,2,4,0,450,0,4711335027,66
35,0,경상북도 포항시북구 죽장면 상사리,16,10,0,1838,0,4711335029,2
30,0,경상북도 포항시북구 죽장면 하사리,25,19,0,790,0,4711335030,14
16,0,전라남도 장흥군 장흥읍 축내리,0,2,0,15,0,4680025043,8
25,0,전라남도 장흥군 장흥읍 관덕리,0,3,0,20,0,4680025044,0
28,0,전라남도 장흥군 장흥읍 원도리,0,2,0,18,0,4680025045,8
21,0,전라남도 장흥군 장흥읍 연산리,0,7,0,227,0,4680025047,0
648,0,전라남도 장흥군 관산읍,92,387,0,5640,0,4680025300,320
29,0,전라남도 장흥군 관산읍 성산리,6,18,0,479,0,4680025322,0
50,0,대구광역시 달서구 장동,0,3,0,82,0,2729010900,0
81,0,대구광역시 달서구 장기동,0,4,0,78,0,2729011000,0
97,0,대구광역시 달서구 감삼동,0,1,0,36,0,2729011300,0
98,0,대구광역시 달서구 본리동,0,5,0,6,0,2729011400,0
63,0,대구광역시 달서구 도원동,17,30,0,965,0,2729011600,5
43,0,대구광역시 달서구 진천동,8,5,0,66,0,2729011700,0
27,0,대구광역시 수성구 파동,49,24,0,470,0,2726011000,1
8,0,전라남도 완도군 소안면 이월리,106,6,0,195,0,4689036022,115
31,0,전라남도 완도군 소안면 가학리,104,1,0,32,0,4689036023,93
7,0,전라남도 완도군 소안면 맹선리,142,3,0,11,0,4689036024,66
44,0,전라남도 완도군 소안면 미라리,155,16,0,224,0,4689036026,134
74,0,전라남도 완도군 금당면,562,39,0,568,0,4689037000,145
41,0,전라남도 완도군 금당면 차우리,107,11,0,203,0,4689037021,50
29,0,전라남도 완도군 금당면 육산리,331,24,0,317,0,4689037022,57
4,0,전라남도 완도군 금당면 가학리,124,4,0,47,0,4689037023,38
0,0,경기도 이천시 대포동,5,3,0,365,0,4150011300,0
0,0,경기도 이천시 장록동,21,18,0,155,0,4150011500,0
141,0,경기도 이천시 장호원읍,252,258,0,5399,0,4150025000,0
0,0,경기도 이천시 장호원읍 장호원리,35,18,0,131,0,4150025021,0
16,0,경기도 이천시 장호원읍 진암리,11,3,0,458,0,4150025023,0
17,0,경기도 이천시 장호원읍 어석리,25,8,0,525,0,4150025024,0
10,0,경기도 이천시 장호원읍 송산리,0,25,0,382,0,4150025026,0
0,0,경기도 이천시 장호원읍 방추리,2,0,0,250,0,4150025027,0
0,0,경기도 이천시 장호원읍 이황리,6,8,0,712,0,4150025029,0
0,0,경기도 이천시 장호원읍 나래리,13,10,0,444,0,4150025030,0
66,0,경기도 이천시 장호원읍 풍계리,39,28,0,526,0,4150025032,0
24,0,경기도 이천시 장호원읍 노탑리,54,81,0,246,0,4150025033,0
45,0,대구광역시 서구 내당동,0,0,0,141,0,2717010100,0
14,0,대구광역시 서구 비산동,39,58,0,372,0,2717010200,0
9,0,대구광역시 서구 상리동,0,1,0,237,0,2717010400,0
71,0,대구광역시 서구 중리동,0,0,0,145,0,2717010500,0
0,0,대구광역시 서구 원대동1가,6,2,0,16,0,2717010700,0
0,0,대구광역시 서구 원대동2가,8,0,0,0,0,2717010800,0
4,0,대구광역시 남구 이천동,62,15,0,27,0,2720010100,0
138,0,대구광역시 남구 봉덕동,30,13,0,467,0,2720010200,0
858,0,대구광역시 북구,690,611,0,7267,0,2723000000,0
3,0,대구광역시 북구 칠성동1가,18,5,0,0,0,2723010100,0
41,0,대구광역시 동구 덕곡동,11,1,0,219,0,2714014400,10
4,0,대구광역시 동구 괴전동,0,8,0,102,0,2714012600,0
0,0,대구광역시 동구 금강동,62,91,0,104,0,2714012700,0
2,0,경상북도 예천군 보문면 옥천리,13,15,0,172,0,4790035039,0
28,0,경상북도 예천군 보문면 우래리,34,30,0,773,0,4790035041,0
10,0,경상북도 예천군 보문면 오신리,5,23,0,325,0,4790035043,0
0,0,대전광역시 서구 용촌동,32,29,0,197,0,3017012500,1
0,0,대전광역시 서구 봉곡동,116,35,0,319,0,3017012600,4
3,0,대전광역시 서구 괴곡동,58,52,0,474,0,3017012700,0
595,0,대전광역시 유성구,1987,622,0,14304,0,3020000000,65
7,0,대전광역시 유성구 원내동,3,0,0,223,0,3020010100,0
17,0,대전광역시 유성구 교촌동,0,1,0,194,0,3020010200,0
57,0,경기도 김포시 하성면 원산리,0,0,0,210,0,4157036028,12
8,0,경상북도 예천군 풍양면 하풍리,45,85,0,237,0,4790041026,0
10,0,경상북도 예천군 풍양면 삼강리,27,75,0,185,0,4790041027,7
7,0,경상북도 예천군 풍양면 풍신리,18,10,0,603,0,4790041036,0
29,0,경상북도 예천군 풍양면 고산리,111,8,0,229,0,4790041038,0
7,0,경상북도 예천군 풍양면 공덕리,40,9,0,361,0,4790041039,5
0,0,대전광역시 대덕구 오정동,14,25,0,266,0,3023010100,0
1,0,경기도 안성시 금광면 상중리,34,2,0,581,0,4155032024,0
0,0,경기도 안성시 금광면 금광리,29,66,0,190,0,4155032025,0
0,0,경기도 안성시 금광면 삼흥리,30,4,0,651,0,4155032027,0
6,0,경기도 안성시 금광면 사흥리,72,13,0,820,0,4155032028,0
4,0,경기도 안성시 금광면 한운리,67,8,0,652,0,4155032030,0
1,0,경기도 안성시 금광면 오산리,10,9,0,270,0,4155032031,0
0,0,경기도 안성시 금광면 석하리,11,3,0,277,0,4155032033,0
0,0,경기도 안성시 대덕면 모산리,0,4,0,316,0,4155035023,0
0,0,경기도 안성시 대덕면 보동리,0,4,0,257,0,4155035024,0
2,0,경기도 안성시 보개면 북좌리,2,2,0,255,0,4155031023,0
3,0,경기도 안성시 보개면 상삼리,36,12,0,386,0,4155031024,0
0,0,경기도 안성시 보개면 신장리,0,2,0,135,0,4155031025,0
16,0,경상북도 울진군 울진읍 호월리,23,48,0,629,0,4793025030,0
171,0,경상북도 울진군 평해읍,324,159,0,3095,0,4793025300,0
33,0,경상북도 울진군 죽변면 후정리,30,10,0,477,0,4793037022,0
26,0,경상북도 울진군 죽변면 화성리,11,10,0,685,0,4793037023,0
3,0,경상북도 울진군 죽변면 봉평리,17,9,0,436,0,4793037024,0
57,0,경상북도 울진군 후포면 후포리,28,19,0,369,0,4793038021,0
24,0,전라남도 보성군 복내면 용전리,0,60,0,256,0,4678035028,0
34,0,전라남도 보성군 복내면 유정리,0,25,0,268,0,4678035029,0
29,0,전라남도 보성군 복내면 장천리,42,8,0,717,0,4678035031,26
113,0,전라남도 보성군 문덕면,371,673,0,4758,0,4678036000,48
24,0,전라남도 보성군 회천면 봉강리,3,4,0,556,0,4678039024,42
18,0,전라남도 보성군 회천면 영천리,0,45,0,497,0,4678039026,21
18,0,전라남도 보성군 회천면 동율리,3,2,0,338,0,4678039027,19
41,0,서울특별시 강서구 과해동,0,11,0,219,0,1150011100,8
11,0,서울특별시 강서구 오쇠동,0,0,0,42,0,1150011300,45
0,0,서울특별시 구로구 신도림동,12,32,0,95,0,1153010100,0
0,0,서울특별시 구로구 구로동,1,41,0,486,0,1153010200,0
0,0,서울특별시 구로구 가리봉동,0,0,0,41,0,1153010300,0
0,0,서울특별시 영등포구 양화동,60,90,0,19,0,1156013100,0
5,0,서울특별시 강남구 일원동,63,22,0,221,0,1168011400,0
2,0,경상북도 경산시 진량읍 아사리,0,5,0,231,0,4729025334,0
6,0,경상북도 경산시 하양읍 남하리,61,22,0,558,0,4729025033,0
0,0,경상북도 경산시 하양읍 환상리,59,65,0,126,0,4729025035,0
710,0,경상북도 경산시 진량읍,96,307,0,3516,0,4729025300,0
14,0,경상북도 경산시 진량읍 신상리,0,18,0,362,0,4729025321,0
53,0,경상북도 경산시 진량읍 봉회리,0,1,0,60,0,4729025324,0
66,0,경상북도 경산시 진량읍 북리,1,6,0,120,0,4729025325,0
54,0,경상북도 경산시 진량읍 부기리,72,16,0,32,0,4729025326,0
47,0,경상북도 경산시 진량읍 상림리,16,15,0,26,0,4729025328,0
44,0,경상북도 경산시 진량읍 내리리,0,27,0,127,0,4729025329,0
0,0,경상북도 경산시 진량읍 평사리(坪沙),0,19,0,54,0,4729025331,0
13,0,경상북도 경산시 진량읍 다문리,0,1,0,135,0,4729025333,0
4,0,서울특별시 송파구 송파동,17,0,0,111,0,1171010400,0
39,0,서울특별시 송파구 가락동,40,35,0,229,0,1171010700,0
49,0,서울특별시 송파구 문정동,60,13,0,139,0,1171010800,0
9,0,서울특별시 송파구 방이동,79,25,0,334,0,1171011100,0
2,0,서울특별시 송파구 오금동,9,5,0,148,0,1171011200,0
102,0,서울특별시 송파구 거여동,1,1,0,135,0,1171011300,0
16,0,서울특별시 송파구 마천동,0,2,0,128,0,1171011400,0
270,0,서울특별시 강동구,337,247,0,1595,0,1174000000,6
34,0,경상북도 영천시 대창면 대재리,5,11,0,205,0,4723040029,0
11,0,경상북도 영천시 대창면 사리리,0,27,0,277,0,4723040031,0
65,0,경상북도 영천시 대창면 대창리,28,18,0,130,0,4723040032,0
22,0,경상북도 영주시 상줄동,23,19,0,257,0,4721010900,24
8,0,경상북도 영주시 조와동,92,10,0,771,0,4721011000,0
9,0,경상북도 영덕군 병곡면 각리리,20,11,0,626,0,4777037044,0
57,0,경상북도 영덕군 병곡면 사천리,43,12,0,81,0,4777037045,0
40,0,경상북도 영덕군 병곡면 송천리,30,17,0,23,0,4777037047,0
46,0,경상북도 칠곡군 왜관읍 왜관리,123,127,0,224,0,4785025021,66
40,0,경상북도 칠곡군 왜관읍 석전리,1,29,0,271,0,4785025022,62
34,0,경상북도 칠곡군 왜관읍 매원리,3,13,0,455,0,4785025023,3
63,0,경상북도 칠곡군 왜관읍 삼청리,12,14,0,441,0,4785025025,0
36,0,경상남도 밀양시 상남면 마산리,47,43,0,254,0,4827036025,55
0,0,경상남도 창녕군 고암면 대암리,0,6,0,142,0,4874031024,0
4,0,경상남도 창녕군 남지읍 마산리,27,6,0,256,0,4874025322,0
0,0,경상남도 창녕군 남지읍 용산리,40,46,0,230,0,4874025324,0
7,0,경상남도 창녕군 남지읍 신전리,14,45,0,422,0,4874025325,0
7,0,경상남도 창녕군 남지읍 아지리,13,37,0,461,0,4874025327,0
26,0,부산광역시 부산진구 개금동,1,3,0,242,0,2623011100,82
118,0,부산광역시 동래구,176,28,0,1219,0,2626000000,127
17,0,부산광역시 동래구 안락동,0,13,0,172,0,2626010200,29
13,0,부산광역시 동래구 칠산동,0,0,0,25,0,2626010300,0
1,0,부산광역시 동래구 복천동,0,0,0,39,0,2626010500,0
1,0,부산광역시 동래구 수안동,14,2,0,47,0,2626010600,0
45,0,부산광역시 동래구 온천동,137,9,0,413,0,2626010800,24
12,0,부산광역시 동래구 사직동,21,1,0,212,0,2626010900,51
37,0,경상북도 경주시 구황동,16,19,0,158,0,4713012200,1
0,0,경상북도 경주시 황성동,166,66,0,154,0,4713012400,0
16,0,경상북도 경주시 용강동,21,7,0,438,0,4713012500,26
1082,0,경상북도 경주시 외동읍,422,329,0,8674,0,4713025900,466
65,0,경상북도 경주시 외동읍 모화리,68,57,0,868,0,4713025922,34
39,0,경상북도 경주시 외동읍 석계리,82,27,0,1237,0,4713025923,45
25,0,경상북도 경주시 외동읍 냉천리,22,17,0,648,0,4713025925,30
20,0,경상북도 경주시 효현동,8,20,0,434,0,4713011600,6
46,0,경상북도 포항시북구 기북면 탑정리,6,13,0,656,0,4711336026,38
27,0,경상북도 포항시북구 기북면 성법리,4,7,0,1164,0,4711336027,65
0,0,경상북도 경주시 동부동,0,0,0,12,0,4713010100,0
8,678,경상북도 울릉군,4679,213,0,1821,0,4794000000,0
0,0,대전광역시 대덕구 부수동,7,54,0,34,0,3023012200,0
0,0,대전광역시 대덕구 황호동,7,163,0,94,0,3023012300,2
0,0,대전광역시 대덕구 삼정동,23,56,0,231,0,3023012400,0
17,0,대전광역시 대덕구 신탄진동,14,20,0,193,0,3023012600,0
5818,0,울산광역시,3476,4649,0,81220,0,3100000000,10764
240,0,울산광역시 중구,243,188,0,2901,0,3111000000,125
1,0,울산광역시 중구 학산동,9,0,0,15,0,3111010200,4
11,0,경상남도 밀양시 산외면 엄광리,4,6,0,656,0,4827033026,3
67,0,경상남도 밀양시 부북면 용지리,0,3,0,195,0,4827031036,28
145,0,경상남도 밀양시 상동면,163,271,0,4613,0,4827032000,34
15,0,경상남도 밀양시 상동면 금산리,17,42,0,388,0,4827032021,0
46,0,경상남도 밀양시 상동면 안인리,46,45,0,659,0,4827032023,13
18,0,경기도 안성시 죽산면 두현리,11,9,0,184,0,4155040024,0
23,0,경기도 안성시 죽산면 장계리,43,8,0,676,0,4155040026,0
1,0,경기도 안성시 대덕면 진현리,0,3,0,239,0,4155035026,0
0,0,경기도 안성시 대덕면 건지리,0,2,0,155,0,4155035027,0
8,0,경기도 안성시 대덕면 내리,29,8,0,252,0,4155035028,6
4,0,경기도 안성시 대덕면 죽리,11,23,0,148,0,4155035030,11
0,0,경기도 안성시 대덕면 신령리,4,10,0,326,0,4155035031,5
0,0,경기도 안성시 대덕면 무능리,3,12,0,194,0,4155035032,0
1,0,경기도 안성시 대덕면 삼한리,0,5,0,245,0,4155035034,0
22,0,대전광역시 유성구 덕명동,244,48,0,247,0,3020011300,0
25,0,대전광역시 유성구 원신흥동,16,12,0,149,0,3020011400,0
4,0,대전광역시 유성구 복용동,22,2,0,174,0,3020011600,0
27,0,충청남도 공주시 우성면 신웅리,40,18,0,133,0,4415038027,0
15,0,충청남도 공주시 우성면 한천리,61,16,0,628,0,4415038029,0
1,0,충청남도 공주시 우성면 동곡리,0,0,0,145,0,4415038030,0
0,0,충청남도 공주시 우성면 귀산리,0,0,0,109,0,4415038032,0
4,0,충청남도 공주시 정안면 대산리,68,14,0,803,0,4415037038,0
0,0,충청남도 공주시 정안면 광정리,19,15,0,283,0,4415037021,0
3,0,충청남도 공주시 정안면 상룡리,16,0,0,253,0,4415037022,0
0,0,충청남도 공주시 정안면 화봉리,12,6,0,355,0,4415037023,0
1,0,충청남도 공주시 정안면 북계리,25,18,0,374,0,4415037025,0
0,0,충청남도 공주시 정안면 석송리,6,15,0,121,0,4415037026,0
4,0,충청남도 공주시 정안면 쌍달리,34,0,0,367,0,4415037028,0
2,0,충청남도 공주시 정안면 고성리,48,22,0,600,0,4415037029,0
182,0,경기도 김포시 월곶면,10,928,0,4056,0,4157035000,2
1,0,경기도 김포시 월곶면 군하리,8,14,0,391,0,4157035021,0
1,0,경기도 안성시 죽산면 용설리,5,44,0,861,0,4155040027,0
5,0,경기도 안성시 죽산면 칠장리,72,2,0,598,0,4155040028,0
4,0,경기도 안성시 죽산면 당목리,3,6,0,721,0,4155040029,1
82,0,경기도 안성시 삼죽면,191,87,0,3558,0,4155041000,6
13,0,경기도 안성시 삼죽면 내장리,0,5,0,298,0,4155041021,0
0,0,경기도 안성시 삼죽면 율곡리,6,1,0,623,0,4155041022,5
0,0,경기도 안성시 삼죽면 용월리,1,2,0,200,0,4155041023,0
8,0,경기도 안성시 삼죽면 배태리,32,16,0,367,0,4155041025,0
1,0,경기도 안성시 삼죽면 내강리,22,18,0,266,0,4155041026,0
1,0,경기도 파주시 법원읍 갈곡리,322,0,0,399,0,4148025627,0
0,0,경기도 파주시 법원읍 금곡리,6,0,0,0,0,4148025630,0
15,0,경기도 파주시 월롱면 도내리,104,8,0,40,0,4148031022,0
0,0,경기도 파주시 탄현면,0,745,0,811,0,4148032000,0
35,0,경기도 파주시 파주읍,108,5,0,290,0,4148025300,0
0,0,경기도 파주시 파주읍 백석리,0,2,0,22,0,4148025325,0
33,0,경기도 파주시 파주읍 연풍리,59,0,0,93,0,4148025327,0
34,0,대구광역시 달성군 가창면 주리,18,1,0,733,0,2771031029,5
57,0,대구광역시 달성군 가창면 우록리,24,1,0,1123,0,2771031032,8
7,0,대구광역시 달성군 논공읍 위천리,94,86,0,124,0,2771025324,0
39,0,대구광역시 달성군 논공읍 하리,25,21,0,241,0,2771025326,0
77,0,대구광역시 달성군 논공읍 북리,11,5,0,290,0,2771025328,4
45,0,대구광역시 달성군 논공읍 본리리,91,2,0,458,0,2771025329,2
9,0,대구광역시 달성군 다사읍 이천리,1,20,0,462,0,2771025621,0
11,0,대구광역시 달성군 다사읍 달천리,0,8,0,88,0,2771025622,0
56,0,대구광역시 달성군 다사읍 방천리,30,33,0,255,0,2771025624,0
9,0,경상북도 의성군 점곡면 서변리,80,22,0,264,0,4773032029,0
1,0,경상북도 의성군 점곡면 황룡리,0,3,0,437,0,4773032030,0
5,0,경상북도 의성군 점곡면 구암리,0,5,0,634,0,4773032031,0
10,0,경상북도 의성군 점곡면 명고리,43,20,0,798,0,4773032032,0
3,0,경상북도 의성군 점곡면 동변리,495,38,0,809,0,4773032033,0
19,0,경상북도 상주시 공성면 평천리,10,8,0,346,0,4725035028,1
10,0,경상북도 상주시 공성면 무곡리,20,2,0,351,0,4725035029,1
17,0,경상북도 상주시 공성면 초오리,20,16,0,313,0,4725035031,8
30,0,경상북도 상주시 함창읍 신흥리,45,37,0,313,0,4725025032,27
45,0,경상남도 통영시 사량면 양지리,2,13,0,573,0,4822037024,100
31,0,전라남도 화순군 이서면 갈두리,0,0,0,191,0,4679038032,0
451,0,전라남도 화순군 동면,3,110,0,5886,0,4679042000,265
16,0,전라남도 화순군 동면 백용리,1,12,0,285,0,4679042021,6
15,0,경상북도 상주시 내서면 낙서리,15,4,0,237,0,4725037027,0
48,0,경상북도 상주시 내서면 노류리,522,22,0,521,0,4725037029,3
528,0,경상북도 상주시 모동면,2504,230,0,3800,0,4725038000,3
32,0,경상북도 상주시 외남면 신촌리,34,7,0,334,0,4725036023,21
5,0,경상북도 상주시 외서면 이천리,8,15,0,225,0,4725043024,7
33,0,경상북도 상주시 외서면 봉강리,13,12,0,675,0,4725043025,0
6,0,경상북도 상주시 외서면 가곡리,76,5,0,495,0,4725043027,2
10,0,경상북도 상주시 외서면 관현리,0,2,0,434,0,4725043028,0
27,0,경상북도 상주시 내서면 능암리,94,23,0,832,0,4725037021,0
28,0,경상북도 상주시 공성면 용신리,106,3,0,298,0,4725035033,41
24,0,경상북도 상주시 공성면 효곡리,633,4,0,277,0,4725035034,17
16,0,경상북도 상주시 공성면 오광리,0,1,0,229,0,4725035036,17
49,0,전라남도 해남군 북평면 영전리,50,5,0,717,0,4682035025,76
2,0,경상북도 영덕군 영해면 원구리,49,36,0,260,0,4777036036,0
232,0,경상북도 문경시 신기동,10,28,0,234,7,4728010600,0
10,0,경상북도 상주시 공검면 오태리,0,95,0,374,0,4725045024,4
10,0,경상북도 상주시 외서면 대전리,480,6,0,1271,0,4725043031,21
16,0,경상북도 상주시 외서면 예의리,41,16,0,928,0,4725043032,0
188,0,경상북도 상주시 은척면,751,80,0,4272,0,4725044000,116
25,0,경상북도 상주시 은척면 봉상리,139,2,0,327,0,4725044022,22
7,0,경상북도 상주시 은척면 우기리,34,8,0,297,0,4725044023,15
10,0,경상북도 상주시 은척면 문암리,0,3,0,239,0,4725044025,2
6,0,경상북도 청도군 풍각면 차산리,1,11,0,111,0,4782032043,81
50,0,경상북도 청도군 풍각면 덕양리,5,19,0,392,0,4782032044,99
41,0,전라남도 영광군 홍농읍 신석리,0,8,0,129,0,4687025629,179
15,0,전라남도 영광군 대마면 월산리,5,9,0,354,0,4687031021,49
20,0,전라남도 영광군 대마면 송죽리,7,5,0,378,0,4687031023,95
32,0,전라남도 영광군 대마면 원흥리,3,9,0,142,0,4687031025,140
9,0,전라남도 함평군 대동면 금산리,15,10,0,214,0,4686035030,0
13,0,전라남도 함평군 대동면 서호리,0,59,0,494,0,4686035031,0
213,0,전라남도 함평군 나산면,445,193,0,3281,0,4686036000,1397
16,0,전라남도 함평군 나산면 삼축리,13,33,0,250,0,4686036021,146
13,0,전라남도 함평군 나산면 나산리,7,17,0,138,0,4686036023,57
17,0,전라남도 함평군 나산면 신평리,32,3,0,75,0,4686036024,188
30,0,전라남도 영광군 홍농읍 가곡리,0,4,0,103,0,4687025627,113
64,0,전라남도 영광군 백수읍 천마리,0,3,0,338,0,4687025328,38
11448,0,대구광역시,9032,6073,0,121638,0,2700000000,1341
82,0,인천광역시 연수구,0,743,0,4646,0,2818500000,146
28,0,인천광역시 연수구 선학동,0,5,0,190,0,2818510200,17
87,0,대구광역시 달성군 다사읍 서재리,4,40,0,227,0,2771025625,0
29,0,대구광역시 달성군 가창면 삼산리,35,8,0,853,0,2771031031,13
10,0,대구광역시 달성군 다사읍 죽곡리,10,84,0,178,0,2771025627,0
31,0,대구광역시 달성군 다사읍 부곡리,3,32,0,201,0,2771025629,0
21,0,대구광역시 달성군 논공읍 삼리리,11,80,0,245,0,2771025323,0
102,0,대구광역시 달서구 대천동,46,54,0,212,0,2729011900,0
102,0,대구광역시 달서구 월성동,35,5,0,135,0,2729012000,0
179,0,대구광역시 달서구 월암동,2,7,0,56,0,2729012100,0
26,0,대구광역시 달서구 대곡동,1,3,0,361,0,2729012300,0
40,0,대구광역시 달서구 본동,0,0,0,69,0,2729012400,0
322,0,대구광역시 달성군 화원읍,159,79,0,2071,0,2771025000,12
39,0,대구광역시 달성군 화원읍 천내리,43,6,0,26,0,2771025021,0
12,0,경상북도 영덕군 축산면 축산리,73,29,0,414,0,4777035032,0
10,0,경상북도 영덕군 축산면 경정리,1,2,0,308,0,4777035033,0
0,0,경기도 파주시 탄현면 금산리,0,0,0,2,0,4148032031,0
10,0,대전광역시 유성구 안산동,161,8,0,237,0,3020013700,0
30,0,대전광역시 유성구 외삼동,30,2,0,258,0,3020013800,0
0,0,대구광역시 북구 동천동,16,7,0,83,0,2723012400,0
13,0,대구광역시 북구 관음동,0,4,0,300,0,2723012500,0
12,0,대구광역시 북구 태전동,32,16,0,386,0,2723012600,0
5,0,대구광역시 북구 매천동,7,10,0,227,0,2723012700,0
7,0,대구광역시 북구 금호동,15,43,0,355,0,2723012900,0
13,0,대구광역시 북구 사수동,16,17,0,182,0,2723013000,0
924,0,대구광역시 수성구,393,330,0,5949,0,2726000000,69
80,0,대구광역시 수성구 만촌동,0,3,0,552,0,2726010200,0
31,0,대구광역시 수성구 수성동2가,0,0,0,0,0,2726010400,0
34,0,대구광역시 수성구 수성동3가,0,0,0,0,0,2726010500,0
114,0,대구광역시 수성구 황금동,4,3,0,253,0,2726010700,0
62,0,대구광역시 수성구 중동,29,4,0,0,0,2726010800,0
15,0,대구광역시 북구 국우동,7,8,0,520,0,2723012200,0
178,0,경상북도 문경시 공평동,0,5,0,686,8,4728010900,14
4,0,경상북도 문경시 모전동,5,5,0,235,0,4728011000,16
15,0,경상북도 문경시 윤직동,4,2,0,99,0,4728011100,2
502,0,경상북도 문경시 문경읍,3817,293,0,10929,8,4728025000,17
15,0,경상북도 문경시 문경읍 상리,3,0,0,293,0,4728025021,0
5,0,경상북도 문경시 문경읍 하리,18,7,0,84,0,4728025022,1
1,0,경상북도 문경시 문경읍 요성리,8,19,0,290,0,4728025024,0
