alfisols_Area,andisols_Area,bjd_Nm,entisols_Area,etc_Area,histosols_Area,inceptisols_Area,mollisols_Area,stdg_Cd,ultisols_Area
0,0,경상남도 사천시 곤명면 용산리,0,8,0,422,0,4824036022,0
0,0,경상남도 사천시 곤명면 조장리,0,11,0,279,0,4824036023,0
5,0,경상남도 사천시 곤명면 봉계리,1,14,0,417,0,4824036024,0
55,0,경상남도 사천시 곤명면 삼정리,0,2,0,143,0,4824036026,170
16,0,경상남도 사천시 곤명면 마곡리,0,6,0,603,0,4824036028,5
0,0,경상남도 사천시 곤명면 성방리,1,10,0,760,0,4824036029,0
62,0,경상남도 김해시 안동,26,9,0,118,0,4825012000,13
0,0,경상남도 김해시 서상동,0,0,0,28,0,4825010200,0
32,0,경상남도 김해시 부원동,0,10,0,144,0,4825010300,14
2,0,경상남도 김해시 대성동,3,2,0,37,0,4825010500,12
63,0,충청남도 예산군 예산읍 관작리,174,8,0,180,0,4481025028,2
73,0,충청남도 예산군 예산읍 창소리,3,7,0,153,0,4481025029,5
61,0,충청남도 예산군 예산읍 신례원리,67,0,0,230,0,4481025030,0
62,0,충청남도 예산군 예산읍 궁평리,3,7,0,123,0,4481025032,0
12,0,경상북도 의성군 안평면 창길리,427,12,0,490,0,4773046034,0
17,0,경상북도 의성군 안평면 괴산리,25,8,0,557,0,4773046035,0
58,0,경상북도 영천시 금호읍 원기리,8,4,0,21,0,4723025037,0
64,0,경상북도 영천시 금호읍 신대리,119,37,0,25,0,4723025038,0
6,0,경상북도 영천시 금호읍 남성리,15,15,0,321,0,4723025039,0
42,0,경상북도 영천시 금호읍 황정리,73,45,0,81,0,4723025041,0
79,0,경상북도 영천시 청통면 호당리,10,22,0,260,0,4723031021,0
0,0,경상북도 영천시 청통면 우천리,6,13,0,457,0,4723031022,0
8,0,경상북도 영천시 청통면 신덕리,0,8,0,479,0,4723031024,0
63,0,경상북도 영천시 금호읍 관정리,11,20,0,47,0,4723025030,0
18,0,경상북도 영천시 금호읍 구암리,2,38,0,428,0,4723025031,0
26,0,경상북도 영천시 금호읍 대곡리,0,8,0,252,0,4723025033,0
23,0,경상북도 영천시 금호읍 호남리,0,42,0,230,0,4723025034,0
98,0,경상북도 영천시 화산면 유성리,17,17,0,258,0,4723033033,0
160,0,경상남도 김해시 상동면,307,379,0,5607,0,4825036000,420
3,0,경상남도 김해시 한림면 용덕리,0,6,0,286,0,4825034025,39
15,0,경상남도 김해시 한림면 안곡리,16,5,0,393,0,4825034026,90
110,0,경상남도 김해시 한림면 장방리,0,81,0,524,0,4825034028,0
17,0,경상남도 김해시 한림면 시산리,100,267,0,366,0,4825034029,0
262,0,경상남도 김해시 주촌면,112,85,0,2141,0,4825032000,526
10,0,경상남도 김해시 주촌면 원지리,20,11,0,443,0,4825032022,116
17,0,경상남도 김해시 주촌면 덕암리,9,7,0,396,0,4825032023,70
60,0,충청남도 논산시 광석면 율리,0,0,0,187,0,4423032032,0
40,0,충청남도 논산시 광석면 오강리,1,0,0,132,0,4423032033,0
2,0,충청남도 논산시 노성면 읍내리,5,1,0,315,0,4423033021,1
0,0,충청남도 논산시 노성면 두사리,0,0,0,119,0,4423033022,0
9,0,충청남도 논산시 노성면 송당리,47,5,0,259,0,4423033023,3
1,0,충청남도 논산시 노성면 하도리,6,12,0,297,0,4423033025,0
4,0,경상북도 영주시 부석면 보계리,0,0,0,773,0,4721039030,1
88,0,경상북도 영천시 금호읍 오계리,8,11,0,118,0,4723025036,0
41,0,경상남도 합천군 대양면,109,177,0,5373,0,4889041000,0
7,0,경상남도 합천군 대양면 정양리,11,91,0,291,0,4889041021,0
0,0,경상남도 합천군 대양면 아천리,0,33,0,380,0,4889041022,0
1,0,경상남도 합천군 대양면 무곡리,95,13,0,633,0,4889041024,0
6,0,경상남도 합천군 대양면 덕정리,0,9,0,383,0,4889041025,0
8,0,경상남도 김해시 진례면 신안리,24,24,0,596,0,4825033025,146
39,0,경상남도 김해시 진례면 산본리,14,13,0,454,0,4825033026,44
3,0,경상남도 김해시 진례면 신월리,81,4,0,146,0,4825033027,6
130,0,경상남도 김해시 진례면 담안리,7,13,0,238,0,4825033029,44
317,0,경상남도 김해시 한림면,254,527,0,4348,0,4825034000,480
7,0,경상남도 김해시 한림면 명동리,1,11,0,402,0,4825034021,27
10,0,경상남도 김해시 한림면 병동리,0,11,0,452,0,4825034023,60
7,0,충청남도 보령시 미산면 늑전리,0,16,0,403,0,4418039025,0
3,0,충청남도 보령시 미산면 도흥리,0,0,0,915,0,4418039026,0
5,0,충청남도 보령시 미산면 봉성리,0,6,0,361,0,4418039027,0
2,0,충청남도 보령시 미산면 은현리,0,0,0,260,0,4418039029,0
2,0,충청남도 보령시 미산면 내평리,0,4,0,336,0,4418039030,0
66,0,충청남도 논산시 노성면 죽림리,14,0,0,172,0,4423033026,24
122,0,충청남도 논산시 광석면 갈산리,0,0,0,241,0,4423032024,0
63,0,충청남도 논산시 광석면 광리,0,0,0,72,0,4423032025,0
105,0,충청남도 논산시 광석면 산동리,10,0,0,129,0,4423032027,0
0,0,충청남도 논산시 광석면 왕전리,5,3,0,268,0,4423032029,0
1,0,충청남도 논산시 광석면 항월리,9,7,0,272,0,4423032030,2
19,0,경상북도 안동시 일직면 조탑리,18,33,0,638,0,4717035030,0
29,0,경상북도 안동시 풍천면 금계리,0,8,0,712,0,4717034027,0
17,0,경상북도 안동시 풍천면 구호리,2,12,0,476,0,4717034028,0
102,0,경상북도 안동시 풍천면 어담리,16,8,0,1500,0,4717034029,0
0,0,경상북도 안동시 풍천면 가곡리,75,21,0,327,0,4717034031,0
18,0,경상북도 안동시 풍천면 하회리,54,95,0,404,0,4717034033,0
367,0,경상북도 안동시 일직면,1194,341,0,6668,0,4717035000,2
65,0,경상북도 안동시 일직면 귀미리,48,64,0,647,0,4717035021,0
65,0,경상북도 안동시 일직면 망호리,31,14,0,300,0,4717035023,0
138,0,경상북도 영천시 조교동,44,36,0,12,0,4723010100,0
72,0,경상북도 영천시 야사동,4,5,0,160,0,4723010300,0
15,0,경상북도 영천시 문외동,4,0,0,44,0,4723010500,0
8,0,경상북도 영주시 안정면 대평리,3,7,0,135,0,4721035032,6
19,0,경상북도 영주시 안정면 오계리,20,7,0,477,0,4721035033,29
33,0,경상북도 영덕군 남정면 사암리,0,3,0,937,0,4777032042,4
60,0,전라남도 영광군 법성면 입암리,0,22,0,278,0,4687037026,0
15,0,전라남도 영광군 법성면 월산리,0,10,0,200,0,4687037028,115
4,0,전라남도 보성군 겸백면 용산리,0,32,0,405,0,4678033026,0
0,0,전라남도 장성군 북하면 동현리,38,101,0,197,0,4688040030,0
5,0,전라남도 장성군 장성읍 용곡리,327,147,0,124,0,4688025036,0
141,0,울산광역시 울주군 온양읍,188,124,0,4771,0,3171025600,1226
11,0,울산광역시 울주군 온양읍 발리,4,8,0,491,0,3171025621,169
44,0,울산광역시 울주군 온양읍 망양리,22,18,0,350,0,3171025623,21
5,0,울산광역시 울주군 온양읍 남창리,16,16,0,92,0,3171025624,0
53,0,경상북도 포항시남구 대송면 송동리,0,8,0,53,0,4711131026,115
36,0,경상북도 포항시남구 대송면 제내리,20,19,0,21,0,4711131027,0
6,0,경상북도 포항시남구 대송면 옥명리,0,0,0,56,0,4711131028,181
350,0,경상북도 포항시남구 동해면,210,34,0,3561,0,4711132000,229
17,0,경상북도 포항시남구 동해면 약전리,13,0,0,85,0,4711132022,0
0,0,충청북도 음성군 맹동면 통동리,544,44,0,161,0,4377033029,0
282,0,충청북도 음성군 대소면,11,92,0,3355,0,4377034000,74
1,0,충청북도 음성군 맹동면 본성리,0,1,0,114,0,4377033027,0
219,0,경기도 광주시 도척면,411,99,0,4483,0,4161033000,5
51,0,경기도 광주시 도척면 유정리,70,17,0,367,0,4161033022,0
9,0,경기도 화성시 봉담읍 유리,0,27,0,143,0,4159025332,0
98,0,경기도 화성시 봉담읍,63,124,0,3822,0,4159025300,175
11,0,경기도 화성시 봉담읍 내리,16,3,0,516,0,4159025322,0
18,0,경기도 화성시 봉담읍 수영리,1,2,0,208,0,4159025323,74
0,0,경기도 화성시 봉담읍 와우리,0,0,0,150,0,4159025325,6
2,0,경기도 화성시 봉담읍 수기리,0,5,0,119,0,4159025326,0
22,0,경기도 화성시 봉담읍 왕림리,0,0,0,250,0,4159025328,0
1,0,경기도 화성시 봉담읍 세곡리,2,2,0,136,0,4159025329,0
80,0,전라남도 신안군 자은면 유천리,120,24,0,354,0,4691033024,2
153,0,전라남도 신안군 자은면 유각리,81,43,0,368,0,4691033025,30
79,0,전라남도 신안군 자은면 면전리,33,10,0,129,0,4691033026,6
180,0,전라남도 신안군 자은면 고장리,239,29,0,301,0,4691033028,2
143,0,전라남도 신안군 자은면 구영리,119,8,0,162,0,4691033029,0
76,0,전라남도 신안군 비금면 광대리,145,22,0,204,0,4691034021,0
54,0,전라남도 신안군 비금면 용소리,17,6,0,120,0,4691034022,0
21,0,전라남도 신안군 비금면 가산리,80,36,0,272,0,4691034024,14
27,0,전라남도 신안군 비금면 덕산리,109,39,0,221,0,4691034025,17
10,0,전라남도 신안군 비금면 구림리,110,43,0,221,0,4691034027,19
13,0,전라남도 신안군 비금면 신원리,97,15,0,122,0,4691034028,8
51,0,부산광역시 강서구 죽림동,0,35,0,104,0,2644010500,10
19,0,부산광역시 강서구 식만동,42,34,0,160,0,2644010600,0
9,0,부산광역시 강서구 죽동동,1,35,0,404,0,2644010700,2
199,0,부산광역시 강서구 봉림동,0,261,0,526,0,2644010800,6
12,0,부산광역시 강서구 화전동,27,110,0,154,15,2644011000,38
3,0,경기도 화성시 팔탄면 덕우리,0,0,0,237,0,4159036030,8
3,0,경기도 화성시 서신면 제부리,31,24,0,88,0,4159035026,0
12,0,경기도 화성시 서신면 홍법리,1,0,0,270,0,4159035027,4
30,0,경기도 화성시 서신면 매화리,2,22,0,286,0,4159035029,26
36,0,경기도 화성시 서신면 용두리,0,4,0,420,0,4159035030,0
25,0,경기도 화성시 서신면 백미리,4,12,0,328,0,4159035032,0
305,0,경기도 화성시 팔탄면,40,220,0,4376,0,4159036000,149
15,0,경기도 화성시 팔탄면 창곡리,7,0,0,307,0,4159036022,0
7,0,경기도 화성시 팔탄면 기천리,3,46,0,429,0,4159036023,0
3,0,경기도 화성시 팔탄면 구장리,16,8,0,475,0,4159036025,0
18,0,경기도 화성시 팔탄면 율암리,0,25,0,455,0,4159036026,42
4,0,경기도 화성시 팔탄면 덕천리,0,8,0,261,0,4159036028,1
39,0,전라남도 순천시 낙안면 평촌리,0,3,0,40,0,4615038029,8
62,0,전라남도 구례군 마산면 황전리,68,21,0,1446,0,4673034024,36
186,0,전라남도 구례군 마산면 갑산리,0,3,0,66,0,4673034025,0
488,0,전라남도 구례군 광의면,187,88,0,2385,0,4673035000,217
26,0,전라남도 구례군 광의면 연파리,16,9,0,54,0,4673035021,12
19,0,전라남도 구례군 광의면 대산리,17,14,0,117,0,4673035023,0
113,0,전라남도 구례군 광의면 지천리,34,15,0,136,0,4673035024,0
23,0,전라남도 구례군 광의면 대전리,5,3,0,120,0,4673035026,53
114,0,전라남도 구례군 광의면 온당리,28,7,0,470,0,4673035027,42
275,0,전라남도 구례군 용방면,192,69,0,1905,0,4673036000,19
37,0,전라남도 구례군 용방면 신지리,31,16,0,84,0,4673036022,0
1,0,경상남도 창녕군 영산면 신제리,0,60,0,381,0,4874038027,0
0,0,경상남도 창녕군 영산면 월령리,0,20,0,405,0,4874038028,0
25,0,경상남도 창녕군 장마면,18,159,0,2791,0,4874039000,0
0,0,경상남도 창녕군 장마면 강리,18,17,0,156,0,4874039021,0
70,0,경상북도 영천시 고경면 창상리,43,15,0,19,0,4723038023,0
14,0,경상북도 영천시 고경면 대의리,39,15,0,386,0,4723038024,0
2,0,경상북도 영천시 고경면 오류리,0,15,0,614,0,4723038026,0
4,0,경상북도 영천시 고경면 고도리,1,5,0,431,0,4723038027,0
42,0,경상북도 영천시 고경면 용전리,34,22,0,798,0,4723038029,0
29,0,경상북도 영천시 고경면 상리리,3,8,0,285,0,4723038031,0
7,0,경상북도 영천시 고경면 학리,0,3,0,516,0,4723038032,0
4,0,경상북도 영천시 북안면 원당리,0,2,0,286,0,4723039039,0
0,0,경상남도 사천시 정동면 수청리,0,12,0,212,0,4824031025,0
44,0,경상남도 사천시 사천읍 선인리,0,0,0,77,0,4824025021,0
0,0,경상남도 사천시 사천읍 정의리,0,0,0,44,0,4824025022,0
0,0,경상남도 사천시 사천읍 수석리,0,2,0,164,0,4824025024,0
0,0,경상남도 사천시 사천읍 사주리,5,9,0,117,0,4824025025,0
0,0,경상남도 사천시 사천읍 중선리,28,14,0,142,0,4824025027,0
0,0,경상남도 사천시 사천읍 구암리,0,7,0,675,0,4824025028,0
8,0,경상남도 사천시 사천읍 금곡리,0,5,0,302,0,4824025030,0
15,0,경상남도 사천시 사천읍 두량리,0,50,0,592,0,4824025031,21
1,0,경상남도 사천시 정동면 예수리,6,16,0,242,0,4824031022,0
35,0,경상남도 사천시 정동면 화암리,0,1,0,183,0,4824031023,0
86,0,경상남도 사천시 사천읍,38,107,0,2722,0,4824025000,21
37,0,경상북도 영천시 청통면 신학리,5,8,0,127,0,4723031029,0
8,0,경상북도 영천시 청통면 애련리,17,10,0,473,0,4723031031,0
33,0,경상북도 영천시 청통면 계포리,18,9,0,93,0,4723031032,0
3,0,경상북도 영천시 청통면 신원리,256,18,0,819,0,4723031034,0
139,6,경상북도 영천시 신녕면,493,205,0,7126,0,4723032000,111
33,6,경상북도 영천시 신녕면 치산리,191,33,0,1748,0,4723032021,0
1,0,경상북도 영천시 신녕면 화서리,1,6,0,638,0,4723032023,0
13,0,경상북도 영천시 신녕면 왕산리,122,41,0,810,0,4723032025,0
100,0,경상북도 영천시 임고면 우항리,69,30,0,113,0,4723037031,0
20,0,경상북도 영천시 자양면 용산리,3,106,0,936,0,4723036025,22
23,0,경상북도 영천시 자양면 성곡리,0,184,0,449,0,4723036028,0
5,0,경상남도 김해시 진영읍 하계리,0,3,0,215,0,4825025022,99
11,0,경상남도 김해시 진영읍 방동리,0,2,0,40,0,4825025023,43
139,0,전라남도 보성군 미력면,15,143,0,2603,0,4678032000,170
35,0,전라남도 보성군 미력면 도개리,7,18,0,271,0,4678032021,0
12,0,전라남도 보성군 미력면 미력리,0,1,0,521,0,4678032022,3
12,0,전라남도 보성군 미력면 용정리,2,26,0,321,0,4678032024,54
22,0,전라남도 보성군 미력면 덕림리,6,30,0,261,0,4678032025,2
25,0,전라남도 보성군 미력면 초당리,0,3,0,285,0,4678032027,17
201,0,전라남도 보성군 겸백면,57,222,0,4178,0,4678033000,101
37,0,전라남도 보성군 겸백면 운림리,9,60,0,456,0,4678033022,0
15,0,전라남도 보성군 겸백면 은덕리,0,9,0,504,0,4678033023,3
243,0,경상북도 포항시남구 대송면,28,71,0,2153,0,4711131000,768
22,0,경상북도 포항시남구 대송면 공수리,0,1,0,30,0,4711131021,26
15,0,경상북도 포항시남구 대송면 홍계리,0,1,0,316,0,4711131023,14
17,0,경상북도 포항시남구 대송면 산여리,0,7,0,763,0,4711131024,20
0,0,경상북도 포항시북구 남빈동,3,0,0,3,0,4711310300,0
0,0,경상북도 포항시북구 상원동,3,0,0,3,0,4711310400,0
24,0,경상북도 포항시남구 오천읍 항사리,11,76,0,1763,0,4711125623,38
10,0,경상북도 포항시남구 장기면 대진리,13,7,0,98,0,4711133035,19
3,0,경상북도 포항시남구 장기면 학계리,25,4,0,149,0,4711133037,0
18,0,경상북도 포항시남구 장기면 학곡리,2,6,0,303,0,4711133038,0
25,0,경상북도 포항시남구 장기면 창지리,0,3,0,248,0,4711133040,0
1,0,전라남도 영광군 낙월면 하낙월리,0,0,0,55,0,4687038022,0
0,0,전라남도 영광군 낙월면 임병리,0,8,0,29,0,4687038023,0
11,0,전라남도 영광군 낙월면 월촌리,0,3,0,121,0,4687038025,39
12,0,전라남도 영광군 낙월면 신기리,0,5,0,162,0,4687038026,27
2,0,전라남도 영광군 낙월면 석만리,0,2,0,49,0,4687038028,0
28,0,경기도 광주시 쌍령동,10,13,0,283,0,4161010200,0
25,0,경기도 광주시 송정동,39,12,0,431,0,4161010300,0
17,0,경기도 광주시 회덕동,14,3,0,316,0,4161010400,0
10,0,경기도 광주시 목현동,66,1,0,810,0,4161010600,0
23,0,경기도 광주시 삼동,16,1,0,385,0,4161010700,0
7,0,경기도 광주시 직동,31,0,0,559,0,4161010900,0
18,0,경기도 광주시 태전동,81,16,0,373,0,4161011000,0
3,0,경기도 광주시 장지동,43,20,0,291,0,4161011100,0
13,0,경기도 광주시 목동,67,3,0,517,0,4161011300,0
0,0,경상북도 영주시 안정면 옹암리,0,0,0,189,0,4721035030,10
86,0,경상북도 영천시 녹전동,29,18,0,129,0,4723012100,0
22,0,경상북도 영천시 도림동,5,15,0,549,0,4723012200,0
6,0,경상북도 영주시 안정면 동촌리,12,7,0,278,0,4721035034,10
0,0,경상북도 영주시 장수면 소룡리,23,7,0,387,0,4721034026,0
0,0,경상북도 영주시 장수면 호문리,16,8,0,456,0,4721034027,0
0,0,경상북도 영주시 장수면 파지리,5,0,0,197,0,4721034028,0
9,0,경상북도 영주시 안정면 신전리,0,8,0,117,0,4721035021,4
10,0,경상북도 영주시 안정면 봉암리,17,1,0,238,0,4721035023,6
48,0,경상북도 영주시 안정면 용산리,8,0,0,515,0,4721035024,43
0,0,경상북도 영주시 안정면 묵리,31,4,0,307,0,4721035026,0
7,0,경상북도 영주시 안정면 내줄리,10,20,0,300,0,4721035027,7
46,0,전라남도 보성군 겸백면 남양리,8,21,0,395,0,4678033027,5
21,0,전라남도 보성군 겸백면 사곡리,0,3,0,333,0,4678033028,1
36,0,경상북도 청송군 청송읍 월막리,52,23,0,250,0,4775025021,0
186,0,경기도 성남시수정구,497,109,0,3746,0,4113100000,0
0,0,경기도 성남시수정구 신흥동,1,2,0,175,0,4113110100,0
0,0,경기도 성남시수정구 수진동,20,3,0,103,0,4113110300,0
0,0,경기도 성남시수정구 단대동,0,0,0,80,0,4113110400,0
0,0,경기도 성남시수정구 양지동,0,0,0,126,0,4113110600,0
8,0,경기도 성남시수정구 복정동,17,11,0,342,0,4113110700,0
0,0,경기도 성남시수정구 신촌동,9,5,0,66,0,4113110900,0
2,0,경기도 성남시수정구 오야동,32,10,0,74,0,4113111000,0
27,0,경상북도 포항시남구 동해면 금광리,0,3,0,301,0,4711132023,75
24,0,경상북도 포항시남구 동해면 석리,0,1,0,145,0,4711132025,48
35,0,경상북도 포항시남구 동해면 임곡리,7,0,0,143,0,4711132026,9
10,0,경상북도 포항시남구 동해면 마산리,2,1,0,212,0,4711132028,2
13,0,경상북도 포항시남구 동해면 중흥리,7,1,0,390,0,4711132030,0
12,0,경상북도 포항시남구 동해면 발산리,107,8,0,540,0,4711132031,3
15,0,경상북도 포항시남구 오천읍 진전리,0,43,0,1304,0,4711125624,0
82,0,경상북도 포항시남구 오천읍 갈평리,14,27,0,815,0,4711125625,45
7,0,경상북도 포항시남구 오천읍 용산리,25,14,0,211,0,4711125627,51
26,0,경상북도 포항시남구 오천읍 광명리,3,2,0,245,0,4711125628,50
44,0,경상북도 포항시남구 오천읍 용덕리,70,7,0,77,0,4711125630,0
41,0,전라남도 영광군 법성면 용덕리,0,4,0,155,0,4687037030,88
78,0,전라남도 영광군 법성면 삼당리,0,14,0,111,0,4687037031,113
68,0,전라남도 영광군 낙월면,0,59,0,968,0,4687038000,66
30,0,충청북도 음성군 원남면 주봉리,2,13,0,440,0,4377032029,0
15,0,충청북도 음성군 원남면 문암리,0,4,0,566,0,4377032030,0
4,0,충청북도 음성군 원남면 조촌리,152,87,0,1020,0,4377032031,0
23,0,충청북도 음성군 원남면 덕정리,1,0,0,568,0,4377032033,0
12,0,충청북도 음성군 맹동면 쌍정리,21,3,0,334,0,4377033021,0
5,0,충청북도 음성군 맹동면 인곡리,0,1,0,358,0,4377033022,0
32,0,충청북도 음성군 맹동면 봉현리,0,8,0,227,0,4377033024,0
0,0,충청북도 음성군 맹동면 신돈리,0,1,0,118,0,4377033026,0
27,0,경기도 광주시 도척면 방도리,4,0,0,517,0,4161033023,5
5,0,충청남도 아산시 신창면 창암리,5,3,0,337,0,4420041023,21
22,0,충청남도 아산시 신창면 황산리,6,0,0,216,0,4420041024,9
2,0,충청남도 아산시 신창면 행목리,0,4,0,302,0,4420041025,15
117,0,충청남도 아산시 신창면 신달리,0,22,0,62,0,4420041027,51
69,0,충청남도 아산시 신창면 남성리,0,3,0,245,0,4420041028,156
77,0,충청남도 아산시 신창면 가덕리,0,36,0,180,0,4420041030,60
24,0,충청남도 아산시 신창면 신곡리,0,25,0,163,0,4420041031,34
7712,0,충청남도 서산시,6489,3988,0,43921,0,4421000000,8693
35,0,충청남도 서산시 읍내동,0,7,0,155,0,4421010100,35
84,0,충청남도 서산시 동문동,0,0,0,163,0,4421010200,62
0,0,경기도 구리시 토평동,317,220,0,53,0,4131010700,0
0,0,경기도 화성시 봉담읍 마하리,0,3,0,117,0,4159025331,0
13,0,전라남도 신안군 비금면 죽림리,141,43,0,292,0,4691034030,39
15,0,부산광역시 강서구 녹산동,14,71,0,344,55,2644011100,29
35,0,부산광역시 강서구 구랑동,22,8,0,390,0,2644011300,35
60,0,부산광역시 강서구 지사동,8,22,0,1054,0,2644011400,85
19,0,부산광역시 강서구 범방동,6,46,0,352,0,2644011600,9
0,0,부산광역시 강서구 신호동,0,366,0,0,42,2644011700,0
0,0,경기도 화성시 팔탄면 지월리,11,6,0,189,0,4159036029,0
22,0,경기도 화성시 서신면 송교리,0,26,0,280,0,4159035025,2
39,0,경기도 화성시 송산면 용포리,0,24,0,203,0,4159034024,20
47,0,경기도 화성시 송산면 고정리,1,148,0,362,0,4159034025,114
3,0,경기도 화성시 송산면 천등리,0,3,0,220,0,4159034027,2
29,0,경기도 화성시 송산면 신천리,0,10,0,183,0,4159034028,5
20,0,경기도 화성시 송산면 마산리,0,8,0,312,0,4159034030,23
4,0,경기도 화성시 송산면 고포리,1,16,0,272,0,4159034031,66
2,0,경기도 화성시 송산면 중송리,0,5,0,265,0,4159034033,15
6,0,경기도 화성시 송산면 육일리,0,0,0,206,0,4159034034,0
262,0,경기도 화성시 서신면,84,251,0,3668,0,4159035000,67
21,0,경기도 화성시 서신면 전곡리,16,60,0,573,0,4159035021,0
0,0,경상남도 고성군 고성읍 성내리,0,0,0,15,0,4882025021,0
3,0,경상남도 고성군 고성읍 서외리,16,0,0,29,0,4882025022,0
45,0,경상남도 고성군 고성읍 동외리,0,0,0,58,0,4882025024,27
123,0,경상남도 고성군 고성읍 송학리,3,7,0,55,0,4882025025,0
15,0,전라남도 순천시 낙안면 옥산리,1,3,0,97,0,4615038028,19
2,0,전라남도 구례군 마산면 광평리,23,13,0,243,0,4673034022,16
35,0,전라남도 강진군 군동면 파산리,3,14,0,508,0,4681031021,32
50,0,전라남도 강진군 군동면 라천리,0,4,0,308,0,4681031023,5
86,0,전라남도 강진군 군동면 화산리,6,15,0,806,0,4681031025,37
9,0,전라남도 강진군 군동면 용소리,3,34,0,594,0,4681031026,8
30,0,전라남도 강진군 군동면 장산리,8,17,0,625,0,4681031028,0
42,0,전라남도 강진군 군동면 덕천리,11,61,0,442,0,4681031029,0
8,0,전라남도 강진군 군동면 쌍덕리,0,5,0,173,0,4681031031,8
33,0,전라남도 강진군 군동면 금사리,19,22,0,523,0,4681031032,0
441,0,전라남도 강진군 칠량면,466,137,0,4841,0,4681032000,122
51,0,전라남도 강진군 칠량면 동백리,0,2,0,522,0,4681032022,1
0,0,경상북도 상주시 성하동,5,0,0,0,0,4725010100,0
106,0,경상북도 상주시 성동동,28,2,0,33,0,4725010200,0
4,0,경상북도 상주시 복룡동,83,32,0,36,0,4725010400,0
0,0,경상북도 상주시 냉림동,25,10,0,46,0,4725010500,0
4,0,경상북도 상주시 남성동,39,0,0,19,0,4725010700,0
0,0,경상북도 상주시 서문동,14,0,0,7,0,4725010800,0
4,0,경상북도 영천시 북안면 관리,0,8,0,365,0,4723039038,0
7,0,경상북도 상주시 함창읍 척동리,15,8,0,52,0,4725025030,6
13,0,경상북도 상주시 함창읍 태봉리,15,25,0,138,0,4725025031,20
71,0,경상북도 영천시 북안면 반정리,13,27,0,413,0,4723039041,0
2,0,경상북도 영천시 북안면 도유리,0,10,0,319,0,4723039024,0
2,0,경상남도 사천시 늑도동,0,5,0,43,0,4824012000,0
0,0,경상남도 사천시 신수동,0,12,0,101,0,4824012100,0
0,0,경상남도 사천시 백천동,69,19,0,561,0,4824012200,1
31,0,경상남도 사천시 대포동,0,3,0,30,0,4824012500,0
61,0,경상남도 사천시 송포동,1,7,0,352,0,4824012600,0
18,0,경상남도 밀양시 무안면 화봉리,47,11,0,642,0,4827038024,59
1,0,경상남도 밀양시 무안면 양효리,1,7,0,296,0,4827038026,79
1,0,경상북도 영천시 자양면 용화리,12,14,0,1326,0,4723036029,103
5,0,경상북도 영천시 임고면 양항리,64,42,0,211,0,4723037021,0
15,0,경상북도 영천시 임고면 덕연리,100,32,0,264,0,4723037023,0
72,0,경상북도 영천시 임고면 삼매리,71,41,0,853,0,4723037024,2
40,0,경상북도 영천시 임고면 황강리,5,5,0,95,0,4723037026,0
78,0,경상북도 영천시 임고면 효리,46,23,0,535,0,4723037027,0
18,0,경상북도 영천시 임고면 사리,29,71,0,1254,0,4723037029,0
32,0,경상북도 영천시 임고면 수성리,11,14,0,1746,0,4723037030,147
46,0,경상북도 영천시 자양면 충효리,28,86,0,951,0,4723036023,23
26,0,경상북도 영천시 북안면 상리,6,9,0,380,0,4723039021,70
22,0,경상북도 영천시 북안면 당리,2,7,0,227,0,4723039022,1
14,0,경상북도 영천시 자양면 신방리,2,7,0,685,0,4723036026,0
37,0,경상남도 김해시 삼계동,12,16,0,733,0,4825010700,206
53,0,경상남도 김해시 내동,57,14,0,126,0,4825010800,3
9,0,경상남도 사천시 곤명면 추천리,0,4,0,313,0,4824036021,0
6,0,경상남도 사천시 축동면 가산리,2,34,0,345,0,4824034026,0
0,0,경상남도 사천시 축동면 구호리,0,13,0,178,0,4824034027,0
89,0,경상남도 사천시 곤양면,93,179,0,5749,0,4824035000,2
0,0,경상남도 사천시 곤양면 남문외리,0,4,0,45,0,4824035022,0
2,0,경상남도 사천시 곤양면 서정리,0,15,0,359,0,4824035023,0
20,0,경상남도 사천시 곤양면 대진리,0,20,0,593,0,4824035025,0
0,0,경상남도 사천시 곤명면 송림리,1,7,0,315,0,4824036031,0
6,0,경상남도 사천시 곤양면 흥사리,0,9,0,705,0,4824035028,1
48,0,경상북도 영양군 청기면 정족리,23,35,0,1220,0,4776032034,0
10,0,경상북도 영천시 화산면 부계리,2,12,0,146,0,4723033034,0
21,0,경상북도 영천시 쌍계동,8,26,0,134,0,4723012500,0
94,0,경상북도 영천시 도남동,19,18,0,44,0,4723012600,0
50,0,경상북도 영천시 매산동,54,33,0,328,0,4723012700,0
63,0,경상북도 영천시 언하동,20,17,0,118,0,4723012800,0
51,0,경상북도 영천시 서산동,2,29,0,570,0,4723013000,0
