alfisols_Area,andisols_Area,bjd_Nm,entisols_Area,etc_Area,histosols_Area,inceptisols_Area,mollisols_Area,stdg_Cd,ultisols_Area
7,0,경상북도 상주시 공성면 옥산리,9,8,0,79,0,4725035021,0
3,0,경상북도 상주시 공성면 장동리,32,2,0,351,0,4725035023,15
13,0,경상북도 상주시 공성면 영오리,24,2,0,579,0,4725035025,5
16,0,경상북도 상주시 공성면 산현리,202,3,0,648,0,4725035027,18
21,0,경상북도 상주시 공성면 용안리,2,3,0,267,0,4725035030,1
36,0,경상북도 상주시 공성면 봉산리,272,8,0,334,0,4725035035,25
30,0,경상북도 상주시 공성면 신곡리,92,1,0,419,0,4725035038,22
46,0,경상북도 상주시 외남면 구서리,56,8,0,276,0,4725036021,13
15,0,경상남도 밀양시 무안면 신법리,9,9,0,169,0,4827038022,5
2,0,경상남도 밀양시 무안면 죽월리,3,10,0,253,0,4827038025,6
2,0,경상남도 밀양시 무안면 내진리,4,17,0,214,0,4827038027,5
43,0,전라남도 화순군 도곡면 평리,5,15,0,42,0,4679036025,0
3,0,전라남도 화순군 도곡면 천암리,259,26,0,196,0,4679036028,0
6,0,전라남도 화순군 도곡면 미곡리,0,3,0,104,0,4679036030,0
210,0,전라남도 화순군 도암면,2314,84,0,2490,0,4679037000,0
6,0,전라남도 화순군 도암면 도장리,82,4,0,78,0,4679037022,0
43,0,전라남도 화순군 도암면 원천리,18,10,0,299,0,4679037025,0
13,0,전라남도 화순군 도암면 등광리,89,3,0,295,0,4679037028,0
12,0,전라남도 화순군 도암면 호암리,249,7,0,122,0,4679037031,0
13,0,경상북도 의성군 가음면 양지리,2,33,0,144,0,4773036030,0
3,0,경상북도 의성군 가음면 귀천리,49,18,0,182,0,4773036032,0
4,0,경상남도 의령군 부림면 손오리,12,15,0,245,0,4872039025,0
0,0,경상남도 의령군 부림면 여배리,35,10,0,238,0,4872039028,0
1,0,경상남도 의령군 부림면 권혜리,4,4,0,622,0,4872039031,0
14,0,경상남도 의령군 봉수면 청계리,1,2,0,517,0,4872040021,8
2,0,경상남도 의령군 봉수면 신현리,1,6,0,493,0,4872040023,0
1,0,경상남도 의령군 봉수면 서득리,7,16,0,289,0,4872040026,0
100,0,경상남도 의령군 궁류면,142,62,0,4001,0,4872041500,44
0,0,경상남도 의령군 궁류면 압곡리,18,15,0,372,0,4872041524,0
60,0,경상남도 의령군 궁류면 다현리,9,2,0,291,0,4872041527,36
4,0,경상남도 의령군 유곡면 상촌리,0,2,0,384,0,4872042021,0
0,0,경상남도 의령군 유곡면 신촌리,3,0,0,328,0,4872042024,0
37,33,제주특별자치도 제주시 애월읍 상귀리,2,5,0,49,126,5011025323,66
19,0,제주특별자치도 제주시 애월읍 구엄리,18,2,0,138,14,5011025324,0
21,121,제주특별자치도 제주시 애월읍 수산리,140,17,0,29,68,5011025325,0
2,103,제주특별자치도 제주시 애월읍 신엄리,153,0,0,124,129,5011025326,31
0,97,제주특별자치도 제주시 애월읍 장전리,66,2,0,86,77,5011025327,14
0,1293,제주특별자치도 제주시 애월읍 소길리,0,0,0,21,37,5011025328,2
32,909,제주특별자치도 제주시 애월읍 고성리,0,19,0,87,95,5011025329,125
8,151,제주특별자치도 제주시 애월읍 하가리,123,1,0,5,60,5011025330,35
0,1198,제주특별자치도 제주시 애월읍 상가리,126,0,0,46,33,5011025331,7
20,94,제주특별자치도 제주시 애월읍 고내리,53,3,0,43,46,5011025333,2
512,0,경상남도 창원시의창구 대산면,347,388,0,2137,0,4812132000,0
38,0,경상남도 창원시의창구 대산면 갈전리,59,15,0,235,0,4812132021,0
0,0,경상남도 창원시의창구 대산면 일동리,113,54,0,181,0,4812132022,0
13,0,경상남도 창원시의창구 대산면 모산리,54,68,0,297,0,4812132023,0
322,0,경상남도 창원시의창구 대산면 가술리,2,42,0,147,0,4812132024,0
49,0,경상남도 창원시의창구 대산면 제동리,14,9,0,416,0,4812132025,0
1,0,경상남도 창원시의창구 대산면 우암리,10,16,0,370,0,4812132026,0
1,0,경상남도 창원시의창구 대산면 북부리,64,98,0,180,0,4812132027,0
0,0,경상남도 창원시의창구 대산면 유등리,32,85,0,285,0,4812132028,0
88,0,경상남도 창원시의창구 대산면 대방리,0,0,0,23,0,4812132029,0
371,0,경상남도 창원시성산구,275,480,0,7201,0,4812300000,574
0,0,경상남도 창원시마산합포구 장군동2가,0,0,0,3,0,4812514200,0
0,0,경상남도 창원시마산합포구 장군동3가,0,0,0,3,0,4812514300,0
0,0,경상남도 창원시마산합포구 장군동4가,0,0,0,8,0,4812514400,0
0,0,경상남도 창원시마산합포구 장군동5가,0,0,0,2,0,4812514500,0
0,0,경상남도 창원시마산합포구 중성동,0,0,0,10,0,4812514600,0
0,0,경상남도 창원시마산합포구 중앙동1가,0,0,0,5,0,4812514700,0
0,0,경상남도 창원시마산합포구 중앙동2가,0,0,0,13,0,4812514800,0
0,0,경상남도 창원시마산합포구 중앙동3가,0,0,0,14,0,4812514900,0
0,0,경상남도 창원시마산합포구 창동,0,0,0,4,0,4812515000,0
0,0,경상남도 창원시마산합포구 창포동1가,0,0,0,2,0,4812515100,0
0,0,경상남도 창원시마산합포구 창포동2가,0,0,0,3,0,4812515200,0
9,124,제주특별자치도 제주시 도련일동,48,4,0,70,90,5011013000,46
24,16,제주특별자치도 제주시 도련이동,6,3,0,38,56,5011013100,4
0,983,제주특별자치도 제주시 용강동,0,16,0,79,0,5011013200,24
0,922,제주특별자치도 제주시 회천동,26,6,0,183,38,5011013300,99
107,1684,제주특별자치도 제주시 오등동,13,39,0,324,73,5011013400,128
0,956,제주특별자치도 제주시 월평동,0,14,0,31,9,5011013500,22
23,1099,제주특별자치도 제주시 영평동,0,28,0,129,53,5011013600,23
139,496,제주특별자치도 제주시 연동,3,12,0,180,249,5011013700,149
17,36,제주특별자치도 제주시 도평동,36,15,0,42,154,5011013800,6
46,2183,제주특별자치도 제주시 해안동,31,61,0,193,133,5011013900,386
33,0,제주특별자치도 제주시 내도동,77,13,0,8,17,5011014000,0
61,0,경상남도 김해시 주촌면 선지리,0,8,0,122,0,4825032021,104
74,0,경상남도 김해시 주촌면 천곡리,30,14,0,175,0,4825032024,51
362,0,경상남도 김해시 진례면,348,129,0,3093,0,4825033000,563
19,0,경상남도 김해시 진례면 시례리,6,4,0,182,0,4825033022,58
21,0,경상남도 김해시 진례면 초전리,158,19,0,74,0,4825033024,0
14,0,경상남도 김해시 진례면 송현리,16,16,0,389,0,4825033028,37
95,0,경상남도 김해시 진례면 고모리,16,15,0,386,0,4825033030,100
2,1094,제주특별자치도 서귀포시 서호동,0,10,0,3,0,5013010300,1
0,0,경기도 수원시팔달구 팔달로1가,5,0,0,0,0,4111512000,0
0,0,경기도 수원시팔달구 팔달로2가,5,0,0,0,0,4111512100,0
0,0,경기도 수원시팔달구 팔달로3가,5,0,0,4,0,4111512200,0
8,0,경기도 여주시 가남읍 오산리,8,12,0,136,0,4167025029,0
24,0,경기도 여주시 가남읍 정단리,43,37,0,158,0,4167025030,0
2,0,경기도 여주시 가남읍 화평리,21,5,0,169,0,4167025031,0
16,0,경기도 여주시 가남읍 본두리,12,6,0,578,0,4167025032,16
0,0,경기도 여주시 가남읍 하귀리,10,7,0,152,0,4167025033,3
0,0,경기도 여주시 가남읍 안금리,25,5,0,572,0,4167025034,0
3,0,경기도 여주시 금사면 소유리,105,0,0,214,0,4167033027,0
0,0,경기도 여주시 금사면 상호리,236,0,0,120,0,4167033028,0
1,0,경기도 여주시 금사면 하호리,101,9,0,217,0,4167033029,0
0,0,경기도 여주시 금사면 금사리,47,76,0,263,0,4167033030,0
0,0,경기도 여주시 금사면 외평리,32,45,0,330,0,4167033031,0
5,0,경기도 여주시 북내면 장암리,11,11,0,501,0,4167036030,0
2,0,경기도 여주시 북내면 중암리,32,8,0,734,0,4167036031,0
2,0,경기도 여주시 북내면 운촌리,28,9,0,692,0,4167036032,0
1,0,경기도 여주시 북내면 신접리,2,16,0,257,0,4167036033,4
0,0,경기도 여주시 북내면 지내리,3,12,0,353,0,4167036034,6
0,0,경기도 여주시 북내면 가정리,17,17,0,197,0,4167036035,0
163,0,경기도 여주시 강천면,416,441,0,6403,0,4167037000,3
0,0,경기도 여주시 강천면 간매리,17,6,0,530,0,4167037021,0
10,0,경기도 여주시 강천면 걸은리,39,3,0,1004,0,4167037022,0
4,0,경기도 여주시 강천면 이호리,15,35,0,250,0,4167037023,2
115,0,경기도 여주시 강천면 가야리,1,51,0,281,0,4167037024,0
34,0,경기도 여주시 강천면 적금리,6,77,0,361,0,4167037025,1
0,0,경기도 여주시 가남읍 양귀리,82,8,0,527,0,4167025035,0
0,0,경기도 여주시 가남읍 연대리,4,1,0,447,0,4167025036,0
0,0,경기도 여주시 가남읍 금당리,42,2,0,543,0,4167025037,0
3,0,경기도 여주시 가남읍 금곡리,13,3,0,247,0,4167025038,0
2,0,경기도 여주시 가남읍 송림리,1,3,0,440,0,4167025039,0
4,0,경기도 여주시 가남읍 삼승리,3,6,0,292,0,4167025040,0
142,0,경기도 여주시 점동면,933,487,0,5600,0,4167031000,13
0,0,경기도 여주시 점동면 청안리,7,12,0,496,0,4167031021,3
0,0,경기도 여주시 점동면 부구리,5,23,0,199,0,4167031022,0
0,0,경기도 여주시 점동면 덕평리,32,38,0,401,0,4167031023,0
12,0,경기도 여주시 점동면 원부리,17,28,0,188,0,4167031024,0
59,0,경기도 여주시 점동면 관한리,260,27,0,387,0,4167031025,0
15,0,경기도 여주시 점동면 뇌곡리,22,12,0,267,0,4167031026,0
49,0,경기도 여주시 대신면,860,588,0,6076,0,4167035000,7
1,0,경기도 여주시 대신면 후포리,0,1,0,537,0,4167035021,2
0,0,경기도 여주시 대신면 당산리,225,139,0,173,0,4167035022,0
3,0,경기도 여주시 대신면 가산리,4,37,0,323,0,4167035023,0
6,0,경기도 여주시 대신면 천남리,31,72,0,489,0,4167035024,0
4,0,경기도 여주시 대신면 하림리,36,6,0,553,0,4167035025,0
0,0,경기도 여주시 강천면 굴암리,10,42,0,136,0,4167037026,0
0,0,경기도 여주시 강천면 강천리,63,163,0,820,0,4167037027,0
0,0,경기도 여주시 강천면 부평리,98,31,0,1288,0,4167037028,0
0,0,경기도 여주시 강천면 도전리,167,33,0,1734,0,4167037029,0
30,0,경기도 여주시 산북면,2110,37,0,1083,0,4167038000,0
2,0,경기도 여주시 산북면 상품리,256,6,0,374,0,4167038021,0
4,0,경기도 여주시 산북면 송현리,248,1,0,116,0,4167038022,0
0,0,경기도 여주시 산북면 후리,152,0,0,175,0,4167038023,0
7,0,경기도 여주시 산북면 명품리,332,5,0,99,0,4167038024,0
0,0,경기도 여주시 점동면 성신리,22,0,0,261,0,4167031027,0
9,0,경기도 여주시 점동면 당진리,80,20,0,611,0,4167031028,0
41,0,경기도 여주시 점동면 현수리,52,29,0,322,0,4167031029,0
0,0,경기도 여주시 점동면 사곡리,20,7,0,449,0,4167031030,0
0,0,경기도 여주시 대신면 상구리,42,1,0,523,0,4167035026,0
350,0,경상북도 울진군 금강송면,11343,313,0,16160,0,4793039000,1721
92,0,경상북도 울진군 금강송면 삼근리,763,35,0,489,0,4793039021,367
19,0,경상북도 울진군 금강송면 하원리,657,36,0,884,0,4793039022,211
116,0,경상북도 울진군 금강송면 왕피리,4697,99,0,1926,0,4793039023,910
8,0,경상북도 울진군 금강송면 쌍전리,757,25,0,2860,0,4793039024,142
16,0,경상북도 울진군 금강송면 소광리,2290,50,0,5179,0,4793039025,7
44,0,경상북도 울진군 금강송면 전곡리,1124,35,0,3001,0,4793039026,7
54,0,경상북도 울진군 금강송면 광회리,1053,33,0,1823,0,4793039027,77
101,0,경상북도 울진군 매화면,2440,188,0,7082,0,4793040000,357
17,0,경상북도 울진군 매화면 매화리,100,37,0,410,0,4793040021,0
8,0,경상북도 울진군 매화면 금매리,29,15,0,338,0,4793040022,0
2,0,경상북도 울진군 매화면 오산리,24,13,0,605,0,4793040023,0
13,0,경상북도 울진군 매화면 덕신리,11,3,0,551,0,4793040024,0
4,0,경상북도 울진군 매화면 신흥리,0,1,0,652,0,4793040025,31
28,0,경상북도 울진군 매화면 기양리,354,58,0,987,0,4793040026,320
21,0,경상북도 울진군 매화면 갈면리,351,36,0,1611,0,4793040027,6
6,0,경상북도 울진군 매화면 길곡리,1570,24,0,1927,0,4793040028,0
0,0,전라남도 화순군 도암면 우치리,617,3,0,186,0,4679037032,0
4,0,전라남도 화순군 도암면 왕정리,188,2,0,40,0,4679037034,0
0,0,서울특별시 서대문구 충정로3가,0,0,0,26,0,1141010200,0
34,0,서울특별시 서초구 방배동,26,1,0,607,0,1165010100,0
116,0,서울특별시 서초구,473,201,0,3900,0,1165000000,0
19,0,경상북도 영주시 순흥면 청구리,1,2,0,451,0,4721037026,6
15,0,경상북도 영주시 단산면 사천리,28,10,0,294,0,4721038022,0
33,0,경상북도 영주시 단산면 옥대리,93,14,0,743,0,4721038025,37
29,0,경상북도 영주시 단산면 마락리,252,11,0,1593,0,4721038028,0
55,0,경상북도 영주시 부석면 북지리,114,1,0,682,0,4721039022,31
36,0,경상북도 영주시 부석면 소천리,255,13,0,904,0,4721039024,4
18,0,전라남도 함평군 나산면 용두리,9,12,0,266,0,4686036028,54
24,0,전라남도 함평군 나산면 월봉리,30,8,0,269,0,4686036031,76
5,0,전라남도 함평군 나산면 덕림리,10,22,0,128,0,4686036034,68
317,0,전라남도 함평군 해보면,260,81,0,2882,0,4686037000,400
4,0,전라남도 함평군 해보면 대창리,18,9,0,113,0,4686037022,0
26,0,전라남도 함평군 해보면 금덕리,0,9,0,195,0,4686037025,137
0,0,경상남도 진주시 망경동,5,24,0,121,0,4817010100,0
0,0,경상남도 진주시 칠암동,37,31,0,42,0,4817010400,0
0,0,경상남도 진주시 남성동,3,3,0,14,0,4817010700,0
0,0,경상남도 진주시 대안동,0,0,0,9,0,4817010900,0
5,0,경상북도 경산시 남천면 신석리,2,4,0,475,0,4729037025,5
22,0,경상북도 경산시 남천면 송백리,24,8,0,954,0,4729037028,136
214,0,경기도 포천시 가산면 마산리,20,12,0,109,0,4165033021,0
57,0,경기도 포천시 가산면 감암리,25,14,0,136,0,4165033022,0
47,0,경기도 포천시 가산면 방축리,10,13,0,212,0,4165033023,0
19,0,경기도 포천시 가산면 가산리,0,0,0,219,0,4165033024,0
64,0,경기도 포천시 가산면 정교리,1,2,0,235,0,4165033025,0
86,0,경기도 포천시 가산면 금현리,12,3,0,572,0,4165033026,0
48,0,경기도 포천시 가산면 우금리,246,25,0,667,0,4165033027,0
76,0,경기도 포천시 가산면 마전리,100,10,0,323,0,4165033028,0
169,0,경기도 포천시 신북면,3452,174,0,5771,0,4165034000,0
26,0,경기도 포천시 신북면 가채리,91,34,0,584,0,4165034021,0
50,0,경상남도 양산시 원동면 선리,47,46,0,2546,0,4833032026,282
96,0,경상남도 양산시 원동면 화제리,22,102,0,1848,0,4833032028,260
12,0,전라남도 장흥군 안양면 신촌리,1,9,0,429,0,4680032029,0
28,0,전라남도 장흥군 안양면 사촌리,0,11,0,295,0,4680032032,23
53,0,전라남도 장흥군 장동면 봉동리,0,10,0,472,0,4680033021,0
22,0,전라남도 장흥군 장동면 배산리,19,5,0,309,0,4680033023,2
87,0,전라남도 장흥군 장동면 용곡리,1,6,0,534,0,4680033028,2
0,0,대전광역시 대덕구 상서동,0,5,0,239,0,3023011600,0
2,0,대전광역시 동구 마산동,28,55,0,290,0,3011012500,0
6,0,대전광역시 동구 용운동,9,0,0,334,0,3011010900,0
2,0,대전광역시 동구 직동,92,149,0,424,0,3011012700,0
0,0,대전광역시 서구 용문동,47,13,0,39,0,3017010500,0
62,0,대전광역시 유성구 구암동,48,11,0,221,0,3020011200,0
9,0,대전광역시 유성구 봉명동,23,36,0,160,0,3020011100,0
10,0,대전광역시 유성구 상대동,11,4,0,144,0,3020011500,0
12,0,전라남도 담양군 창평면 해곡리,2,10,0,121,0,4671034030,17
24,0,전라남도 담양군 창평면 외동리,43,16,0,680,0,4671034032,0
31,0,전라남도 담양군 대덕면 비차리,3,3,0,382,0,4671035023,0
13,0,전라남도 담양군 대덕면 성곡리,15,9,0,251,0,4671035025,4
21,0,전라남도 영광군 법성면 용성리,0,7,0,156,0,4687037029,205
7,0,전라남도 영광군 낙월면 상낙월리,0,1,0,74,0,4687038021,0
31,0,전라남도 영광군 낙월면 송이리,0,15,0,294,0,4687038024,0
2,0,전라남도 영광군 낙월면 영외리,0,1,0,44,0,4687038027,0
0,0,전라남도 영광군 낙월면 죽도리,0,3,0,14,0,4687038029,0
10,0,전라남도 장성군 장성읍 성산리,31,0,0,132,0,4688025022,18
3,0,전라남도 장성군 장성읍 단광리,118,20,0,602,0,4688025025,0
12,0,전라남도 장성군 장성읍 안평리,33,31,0,295,0,4688025028,9
0,0,경상북도 김천시 황금동,0,0,0,86,0,4715010700,0
13,0,충청남도 천안시서북구 업성동,13,25,0,253,0,4413310900,19
5,0,충청남도 천안시서북구 신당동,58,3,0,287,0,4413311000,0
9,0,충청남도 천안시서북구 부대동,30,4,0,281,0,4413311100,0
72,0,경상남도 거제시 장평동,24,69,0,419,0,4831010800,146
42,0,경상남도 거제시 고현동,27,151,0,284,0,4831010900,54
23,0,경상남도 거제시 상동동,36,14,0,401,0,4831011000,95
13,0,경상남도 거제시 문동동,13,13,0,414,0,4831011100,73
21,0,경상남도 거제시 삼거동,5,8,0,711,0,4831011200,253
45,0,경상남도 거제시 양정동,50,11,0,274,0,4831011300,45
36,0,경상남도 거제시 수월동,39,4,0,497,0,4831011400,115
45,0,인천광역시 서구 불로동,3,1,0,441,0,2826012100,51
367,0,경상북도 상주시 낙동면,1140,432,0,6890,0,4725033000,177
41,0,경상북도 상주시 낙동면 낙동리,115,73,0,166,0,4725033022,2
19,0,경상북도 상주시 낙동면 구잠리,12,7,0,387,0,4725033024,30
31,0,경상북도 상주시 낙동면 내곡리,18,18,0,184,0,4725033030,6
234,0,경기도 김포시 고촌읍 신곡리,31,135,0,231,0,4157025324,95
0,0,경기도 수원시팔달구 남창동,4,0,0,23,0,4111512300,0
0,0,경기도 수원시팔달구 영동,4,0,0,0,0,4111512400,0
0,0,경기도 수원시팔달구 중동,4,0,0,0,0,4111512500,0
1,0,경상남도 창원시마산합포구 진전면 고사리,67,44,0,743,0,4812534036,0
3,0,경상남도 창원시마산합포구 진전면 여양리,17,5,0,969,0,4812534037,22
284,0,경상남도 창원시마산회원구,264,287,0,8045,0,4812700000,214
22,0,경상남도 창원시마산회원구 구암동,0,3,0,263,0,4812710100,25
14,0,경상남도 창원시마산회원구 두척동,22,5,0,648,0,4812710200,0
37,0,경상남도 창원시마산회원구 봉암동,23,74,0,440,0,4812710300,2
0,0,경상남도 창원시마산합포구 두월동1가,0,0,0,1,0,4812511200,0
0,0,경상남도 창원시마산합포구 두월동2가,0,0,0,1,0,4812511300,0
0,0,경상남도 창원시마산합포구 두월동3가,0,0,0,1,0,4812511400,0
1,0,경상남도 창원시마산합포구 문화동,0,0,0,9,0,4812511500,0
0,0,경상남도 창원시마산합포구 반월동,0,0,0,5,0,4812511600,0
0,0,경상남도 창원시마산합포구 부림동,0,0,0,5,0,4812511700,0
0,0,경상남도 창원시마산합포구 산호동,0,14,0,112,0,4812511800,0
0,0,경상남도 창원시마산합포구 상남동,0,2,0,34,0,4812511900,6
0,0,경상남도 창원시마산합포구 서성동,0,0,0,11,0,4812512000,0
0,0,경상남도 창원시마산합포구 성호동,0,0,0,16,0,4812512100,0
6,0,경상남도 창원시마산합포구 진동면 요장리,4,14,0,310,0,4812532025,0
10,0,경상남도 창원시마산합포구 진동면 다구리,0,2,0,261,0,4812532026,0
10,0,경상남도 창원시마산합포구 진동면 교동리,16,16,0,377,0,4812532027,6
5,0,경상남도 창원시마산합포구 진동면 인곡리,13,15,0,449,0,4812532028,83
10,0,경상남도 창원시마산합포구 진동면 태봉리,4,3,0,382,0,4812532029,32
5,0,경상남도 창원시마산합포구 진동면 동전리,24,11,0,655,0,4812532030,37
123,0,경상남도 창원시마산합포구 진북면,137,78,0,4287,0,4812533000,55
1,0,경상남도 창원시마산합포구 진북면 지산리,15,12,0,228,0,4812533021,0
0,0,경상남도 창원시마산합포구 진북면 예곡리,26,3,0,94,0,4812533022,0
15,0,경상남도 창원시마산합포구 진북면 인곡리,53,6,0,704,0,4812533023,4
0,0,경상남도 합천군 덕곡면 병배리,4,5,0,275,0,4889038023,0
2,0,경상남도 합천군 덕곡면 율원리,0,3,0,539,0,4889038026,0
14,0,경상남도 합천군 청덕면 두곡리,0,7,0,480,0,4889039023,0
0,0,경상남도 합천군 청덕면 대부리,41,19,0,629,0,4889039024,0
0,65,제주특별자치도 서귀포시 성산읍 성산리,18,28,0,0,14,5013025921,0
0,522,제주특별자치도 서귀포시 성산읍 오조리,17,50,4,2,9,5013025922,4
0,706,제주특별자치도 서귀포시 성산읍 시흥리,50,12,3,0,0,5013025923,25
0,693,제주특별자치도 서귀포시 성산읍 고성리,157,8,8,0,3,5013025924,0
0,2598,제주특별자치도 서귀포시 성산읍 수산리,0,4,0,0,10,5013025925,0
60,0,경상북도 문경시 마성면 신현리,60,63,0,681,3,4728036025,0
73,0,경상북도 문경시 마성면 남호리,15,12,0,286,23,4728036028,0
427,0,경상북도 문경시 농암면,2190,120,0,7531,2,4728037000,69
38,0,경상북도 문경시 농암면 연천리,63,10,0,866,0,4728037023,2
16,0,경상북도 문경시 농암면 사현리,19,0,0,514,0,4728037029,13
0,0,경상북도 경산시 삼북동,0,0,0,30,0,4729010200,0
0,0,경상북도 경산시 상방동,6,4,0,59,0,4729010500,0
0,0,경상남도 창원시진해구 중앙동,0,0,0,2,0,4812912600,0
0,0,경상남도 창원시진해구 부흥동,0,0,0,1,0,4812912700,0
0,0,경상남도 창원시진해구 중평동,0,0,0,2,0,4812912800,0
0,0,경상남도 창원시진해구 근화동,0,0,0,2,0,4812912900,0
0,0,경상남도 창원시진해구 송죽동,0,0,0,1,0,4812913000,0
74,0,전라남도 해남군 옥천면 용동리,3,25,0,1243,0,4682037034,0
101,0,전라남도 해남군 계곡면 성진리,6,24,0,624,0,4682038021,20
62,0,전라남도 해남군 계곡면 당산리,0,6,0,546,0,4682038024,22
74,0,전라남도 해남군 계곡면 반계리,0,5,0,150,0,4682038027,31
86,0,전라남도 해남군 계곡면 여수리,27,7,0,194,0,4682038030,20
56,0,전라남도 해남군 마산면 화내리,42,6,0,298,0,4682039021,31
31,0,전라남도 해남군 마산면 송석리,6,9,0,370,0,4682039024,0
54,0,전라남도 해남군 마산면 연구리,0,587,0,146,0,4682039028,286
69,0,전라남도 해남군 마산면 상등리,0,43,0,507,0,4682039031,115
110,0,전라남도 해남군 황산면 원호리,2,410,0,511,0,4682040022,200
26,0,전라남도 해남군 황산면 우항리,0,209,0,424,0,4682040025,96
331,0,전라남도 해남군 황산면 한자리,0,389,0,227,0,4682040027,260
13,0,경상북도 상주시 공검면 중소리,14,31,0,440,0,4725045031,3
20,0,경상북도 상주시 이안면 아천리,90,38,0,439,0,4725046026,22
19,0,경기도 광주시 곤지암읍 건업리,44,4,0,743,0,4161025930,0
11,0,경기도 광주시 곤지암읍 장심리,7,3,0,475,0,4161025931,0
4,0,경기도 광주시 곤지암읍 연곡리,13,7,0,233,0,4161025932,0
0,0,경기도 광주시 곤지암읍 오향리,41,6,0,545,0,4161025933,0
20,0,경기도 광주시 곤지암읍 열미리,108,12,0,890,0,4161025934,0
0,0,경기도 광주시 곤지암읍 신대리,25,6,0,284,0,4161025935,0
51,0,경기도 광주시 곤지암읍 삼리,75,11,0,261,0,4161025936,0
25,0,충청남도 서산시 대산읍 독곶리,121,407,0,479,0,4421025031,24
28,0,광주광역시 서구 동천동,12,8,0,70,0,2914013300,0
954,0,경기도 김포시 양촌읍,1,273,0,1785,0,4157025600,349
118,0,경기도 김포시 양촌읍 양곡리,0,4,0,115,0,4157025621,62
214,181,제주특별자치도 제주시 한경면 용수리,116,24,0,111,4,5011031022,165
235,305,제주특별자치도 제주시 한경면 고산리,5,7,0,240,9,5011031023,146
97,204,제주특별자치도 제주시 한경면 판포리,99,3,0,81,98,5011031024,70
11,45,제주특별자치도 제주시 한경면 금등리,29,1,0,62,10,5011031025,21
183,525,제주특별자치도 제주시 한경면 조수리,0,0,0,202,11,5011031026,162
33,234,제주특별자치도 제주시 한경면 두모리,54,2,0,173,17,5011031027,92
9,1,제주특별자치도 제주시 한경면 신창리,88,8,0,54,7,5011031028,26
54,0,울산광역시 울주군 상북면 등억알프스리,14,17,0,1386,0,3171038034,25
3,0,경상남도 진주시 충무공동,41,26,0,340,0,4817013700,0
181,0,부산광역시 기장군 정관읍,75,58,0,2976,0,2671025600,535
2,0,부산광역시 기장군 정관읍 방곡리,0,1,0,104,0,2671025621,21
19,0,부산광역시 기장군 정관읍 매학리,0,4,0,229,0,2671025622,32
9,0,부산광역시 기장군 정관읍 임곡리,27,5,0,209,0,2671025623,18
9,0,부산광역시 기장군 정관읍 월평리,0,1,0,108,0,2671025624,46
65,0,부산광역시 기장군 정관읍 달산리,11,12,0,355,0,2671025625,54
11,0,부산광역시 기장군 정관읍 병산리,10,5,0,463,0,2671025626,141
20,0,부산광역시 기장군 정관읍 모전리,5,3,0,260,0,2671025627,16
19,0,부산광역시 기장군 정관읍 용수리,3,9,0,470,0,2671025628,72
12,0,부산광역시 기장군 정관읍 두명리,2,3,0,338,0,2671025629,19
13,0,부산광역시 기장군 정관읍 예림리,15,15,0,441,0,2671025630,116
32,0,경기도 광주시 남한산성면,291,46,0,2992,0,4161037000,0
1,0,경기도 광주시 남한산성면 산성리,34,0,0,196,0,4161037021,0
6,0,경기도 광주시 남한산성면 엄미리,56,0,0,632,0,4161037022,0
0,0,경기도 광주시 남한산성면 광지원리,11,12,0,326,0,4161037023,0
7,0,경기도 광주시 남한산성면 상번천리,35,10,0,493,0,4161037024,0
13,0,경기도 광주시 남한산성면 하번천리,24,15,0,292,0,4161037025,0
2,0,경기도 광주시 남한산성면 오전리,48,7,0,377,0,4161037026,0
2,0,경기도 광주시 남한산성면 불당리,48,1,0,289,0,4161037027,0
3,0,경기도 광주시 남한산성면 검복리,36,1,0,383,0,4161037028,0
41,0,경기도 가평군 조종면,5315,195,0,5721,0,4182034500,0
7,0,경기도 가평군 조종면 현리,122,16,0,350,0,4182034521,0
8,0,경기도 가평군 조종면 신상리,497,36,0,730,0,4182034522,0
8,0,경기도 가평군 조종면 상판리,2341,24,0,744,0,4182034524,0
2,0,경기도 가평군 조종면 신하리,18,21,0,409,0,4182034525,0
6,0,경기도 가평군 조종면 마일리,964,8,0,1022,0,4182034526,0
2,0,경기도 가평군 조종면 대보리,586,52,0,755,0,4182034527,0
